[
  {
    "id": "mv_anthropic__claude-fable-5-1",
    "canonicalModelId": "anthropic/claude-fable-5-1",
    "name": "Claude Fable 5.1",
    "lab": "Anthropic",
    "family": "claude-fable",
    "releaseDate": "2026-09-01",
    "knowledgeCutoff": "2026-06",
    "modalities": {
      "input": [
        "text",
        "image",
        "pdf"
      ],
      "output": [
        "text"
      ]
    },
    "openWeights": false,
    "description": "Claude model for demanding reasoning and long-horizon agentic work",
    "aaUrl": "https://artificialanalysis.ai/models/claude-fable-5-1",
    "availability": "available",
    "releaseBadges": [],
    "reasoningLabel": "可调 5 档",
    "sourceRefs": [
      "models.dev:anthropic/claude-fable-5-1"
    ],
    "snapshotId": "20261029-1e9fc8b3"
  },
  {
    "id": "mv_anthropic__claude-haiku-5-5",
    "canonicalModelId": "anthropic/claude-haiku-5-5",
    "name": "Claude Haiku 5.5",
    "lab": "Anthropic",
    "family": "claude-haiku",
    "releaseDate": "2026-10-07",
    "knowledgeCutoff": "2026-06",
    "modalities": {
      "input": [
        "text",
        "image",
        "pdf"
      ],
      "output": [
        "text"
      ]
    },
    "openWeights": false,
    "description": "Fast Claude model for responsive assistance, classification, and lightweight agents",
    "aaUrl": "https://artificialanalysis.ai/models/claude-haiku-5-5",
    "availability": "available",
    "releaseBadges": [],
    "reasoningLabel": "可调 5 档",
    "sourceRefs": [
      "models.dev:anthropic/claude-haiku-5-5"
    ],
    "snapshotId": "20261029-1e9fc8b3"
  },
  {
    "id": "mv_anthropic__claude-opus-5-5",
    "canonicalModelId": "anthropic/claude-opus-5-5",
    "name": "Claude Opus 5.5",
    "lab": "Anthropic",
    "family": "claude-opus",
    "releaseDate": "2026-09-22",
    "knowledgeCutoff": "2026-06",
    "modalities": {
      "input": [
        "text",
        "image",
        "pdf"
      ],
      "output": [
        "text"
      ]
    },
    "openWeights": false,
    "description": "Claude model for long-running agentic coding and knowledge work",
    "aaUrl": "https://artificialanalysis.ai/models/claude-opus-5-5",
    "availability": "available",
    "releaseBadges": [],
    "reasoningLabel": "可调 5 档",
    "sourceRefs": [
      "models.dev:anthropic/claude-opus-5-5"
    ],
    "snapshotId": "20261029-1e9fc8b3"
  },
  {
    "id": "mv_anthropic__claude-sonnet-5-5",
    "canonicalModelId": "anthropic/claude-sonnet-5-5",
    "name": "Claude Sonnet 5.5",
    "lab": "Anthropic",
    "family": "claude-sonnet",
    "releaseDate": "2026-09-28",
    "knowledgeCutoff": "2026-06",
    "modalities": {
      "input": [
        "text",
        "image",
        "pdf"
      ],
      "output": [
        "text"
      ]
    },
    "openWeights": false,
    "description": "Fast Claude model for everyday coding, agents, and knowledge work",
    "aaUrl": "https://artificialanalysis.ai/models/claude-sonnet-5-5",
    "availability": "available",
    "releaseBadges": [],
    "reasoningLabel": "可调 5 档",
    "sourceRefs": [
      "models.dev:anthropic/claude-sonnet-5-5"
    ],
    "snapshotId": "20261029-1e9fc8b3"
  },
  {
    "id": "mv_mistral__codestral-2508",
    "canonicalModelId": "mistral/codestral-2508",
    "name": "Codestral 2508",
    "lab": "Mistral",
    "family": "codestral",
    "releaseDate": "2025-07-30",
    "knowledgeCutoff": null,
    "modalities": {
      "input": [
        "text",
        "pdf"
      ],
      "output": [
        "text"
      ]
    },
    "openWeights": false,
    "description": "Mistral code model for low-latency completion, fill-in-the-middle, and code generation",
    "aaUrl": null,
    "availability": "available",
    "releaseBadges": [],
    "reasoningLabel": "不支持",
    "sourceRefs": [
      "models.dev:mistral/codestral-2508"
    ],
    "snapshotId": "20261029-1e9fc8b3"
  },
  {
    "id": "mv_cohere__command-a-plus-05-2026",
    "canonicalModelId": "cohere/command-a-plus-05-2026",
    "name": "Command A+",
    "lab": "Cohere",
    "family": "command-a",
    "releaseDate": "2026-05-20",
    "knowledgeCutoff": "2025-04-01",
    "modalities": {
      "input": [
        "text",
        "image"
      ],
      "output": [
        "text"
      ]
    },
    "openWeights": true,
    "description": "Cohere's stronger command model for multilingual agents and enterprise workflows",
    "aaUrl": "https://artificialanalysis.ai/models/command-a-plus",
    "availability": "available",
    "releaseBadges": [],
    "reasoningLabel": "预算可调",
    "sourceRefs": [
      "models.dev:cohere/command-a-plus-05-2026"
    ],
    "snapshotId": "20261029-1e9fc8b3"
  },
  {
    "id": "mv_deepseek__deepseek-v4-pro-0813",
    "canonicalModelId": "deepseek/deepseek-v4-pro-0813",
    "name": "DeepSeek V4 Pro 0813",
    "lab": "DeepSeek",
    "family": "deepseek-thinking",
    "releaseDate": "2026-08-13",
    "knowledgeCutoff": null,
    "modalities": {
      "input": [
        "text"
      ],
      "output": [
        "text"
      ]
    },
    "openWeights": true,
    "description": "DeepSeek V4 Pro snapshot with million-token context and support for thinking and non-thinking modes",
    "aaUrl": "https://artificialanalysis.ai/models/deepseek-v4-pro",
    "availability": "mixed",
    "releaseBadges": [
      "beta"
    ],
    "reasoningLabel": "可调 3 档",
    "sourceRefs": [
      "models.dev:deepseek/deepseek-v4-pro-0813"
    ],
    "snapshotId": "20261029-1e9fc8b3"
  },
  {
    "id": "mv_deepseek__deepseek-v4.1-flash-1017",
    "canonicalModelId": "deepseek/deepseek-v4.1-flash-1017",
    "name": "DeepSeek V4.1 Flash 1017",
    "lab": "DeepSeek",
    "family": "deepseek-flash",
    "releaseDate": "2026-10-17",
    "knowledgeCutoff": "2025-05",
    "modalities": {
      "input": [
        "text",
        "image"
      ],
      "output": [
        "text"
      ]
    },
    "openWeights": true,
    "description": "October 17 update of DeepSeek V4.1 Flash with improved reasoning, coding, agentic tasks, and visual understanding",
    "aaUrl": "https://artificialanalysis.ai/models/deepseek-v4-1-flash-1017",
    "availability": "mixed",
    "releaseBadges": [
      "beta"
    ],
    "reasoningLabel": "可调 3 档",
    "sourceRefs": [
      "models.dev:deepseek/deepseek-v4.1-flash-1017"
    ],
    "snapshotId": "20261029-1e9fc8b3"
  },
  {
    "id": "mv_sakana__fugu-max",
    "canonicalModelId": "sakana/fugu-max",
    "name": "Fugu Max",
    "lab": "Sakana",
    "family": "fugu",
    "releaseDate": "2026-09-11",
    "knowledgeCutoff": null,
    "modalities": {
      "input": [
        "text",
        "image",
        "pdf"
      ],
      "output": [
        "text"
      ]
    },
    "openWeights": false,
    "description": "Multi-agent model for routing expert agents across complex analytical tasks",
    "aaUrl": null,
    "availability": "available",
    "releaseBadges": [],
    "reasoningLabel": "固定 high",
    "sourceRefs": [
      "models.dev:sakana/fugu-max"
    ],
    "snapshotId": "20261029-1e9fc8b3"
  },
  {
    "id": "mv_google__gemini-3.1-pro-preview-customtools",
    "canonicalModelId": "google/gemini-3.1-pro-preview-customtools",
    "name": "Gemini 3.1 Pro (Preview Custom Tools)",
    "lab": "Google",
    "family": "gemini-pro",
    "releaseDate": "2026-02-19",
    "knowledgeCutoff": "2025-01",
    "modalities": {
      "input": [
        "text",
        "image",
        "video",
        "audio",
        "pdf"
      ],
      "output": [
        "text"
      ]
    },
    "openWeights": false,
    "description": "Advanced Gemini model for complex reasoning, coding, and multimodal analysis",
    "aaUrl": "https://artificialanalysis.ai/models/gemini-3-1-pro-preview",
    "availability": "available",
    "releaseBadges": [
      "beta"
    ],
    "reasoningLabel": "可调 3 档",
    "sourceRefs": [
      "models.dev:google/gemini-3.1-pro-preview-customtools"
    ],
    "snapshotId": "20261029-1e9fc8b3"
  },
  {
    "id": "mv_google__gemini-3.5-flash-lite",
    "canonicalModelId": "google/gemini-3.5-flash-lite",
    "name": "Gemini 3.5 Flash Lite",
    "lab": "Google",
    "family": "gemini-flash-lite",
    "releaseDate": "2026-07-21",
    "knowledgeCutoff": "2026-03",
    "modalities": {
      "input": [
        "text",
        "image",
        "video",
        "audio",
        "pdf"
      ],
      "output": [
        "text"
      ]
    },
    "openWeights": false,
    "description": "Fast Gemini model balancing multimodal reasoning, tool use, and cost",
    "aaUrl": "https://artificialanalysis.ai/models/gemini-3-5-flash-lite",
    "availability": "available",
    "releaseBadges": [],
    "reasoningLabel": "可调 4 档",
    "sourceRefs": [
      "models.dev:google/gemini-3.5-flash-lite"
    ],
    "snapshotId": "20261029-1e9fc8b3"
  },
  {
    "id": "mv_google__gemini-3.8-flash",
    "canonicalModelId": "google/gemini-3.8-flash",
    "name": "Gemini 3.8 Flash",
    "lab": "Google",
    "family": "gemini-flash",
    "releaseDate": "2026-09-02",
    "knowledgeCutoff": null,
    "modalities": {
      "input": [
        "text",
        "image",
        "video",
        "audio",
        "pdf"
      ],
      "output": [
        "text"
      ]
    },
    "openWeights": false,
    "description": "Google's most intelligent Flash model, engineered for long-horizon software engineering, autonomous agents, and complex enterprise workflows",
    "aaUrl": "https://artificialanalysis.ai/models/gemini-3-8-flash",
    "availability": "available",
    "releaseBadges": [],
    "reasoningLabel": "可调 3 档",
    "sourceRefs": [
      "models.dev:google/gemini-3.8-flash"
    ],
    "snapshotId": "20261029-1e9fc8b3"
  },
  {
    "id": "mv_zhipuai__glm-4.7-flashx",
    "canonicalModelId": "zhipuai/glm-4.7-flashx",
    "name": "GLM 4.7 FlashX",
    "lab": "Zhipu / GLM",
    "family": "glm-flash",
    "releaseDate": "2026-01-19",
    "knowledgeCutoff": "2025-04",
    "modalities": {
      "input": [
        "text"
      ],
      "output": [
        "text"